{
  "case_id": "GEO-HIST-DELTA-01",
  "keyframe_selection": [
    {
      "keyframe_id": "at_outlet",
      "order": 0,
      "state": {
        "path": "modules/video_model/stage1/output/keyframe_render/delta_sequence/video_handoff.json",
        "sha256": "1dd28eac1f163f933006b9daa0066daca7e9434ebd3b882c0936ae1d32282a5f",
        "size_bytes": 5617
      }
    },
    {
      "keyframe_id": "decelerated_plume",
      "order": 1,
      "state": {
        "path": "modules/video_model/stage1/output/keyframe_render/delta_sequence/video_handoff.json",
        "sha256": "1dd28eac1f163f933006b9daa0066daca7e9434ebd3b882c0936ae1d32282a5f",
        "size_bytes": 5617
      }
    },
    {
      "keyframe_id": "underwater_accumulation",
      "order": 2,
      "state": {
        "path": "modules/video_model/stage1/output/keyframe_render/delta_sequence/video_handoff.json",
        "sha256": "1dd28eac1f163f933006b9daa0066daca7e9434ebd3b882c0936ae1d32282a5f",
        "size_bytes": 5617
      }
    },
    {
      "keyframe_id": "sandbar_emergence",
      "order": 3,
      "state": {
        "path": "modules/video_model/stage1/output/keyframe_render/delta_sequence/video_handoff.json",
        "sha256": "1dd28eac1f163f933006b9daa0066daca7e9434ebd3b882c0936ae1d32282a5f",
        "size_bytes": 5617
      }
    },
    {
      "keyframe_id": "rerouted_flow",
      "order": 4,
      "state": {
        "path": "modules/video_model/stage1/output/keyframe_render/delta_sequence/video_handoff.json",
        "sha256": "1dd28eac1f163f933006b9daa0066daca7e9434ebd3b882c0936ae1d32282a5f",
        "size_bytes": 5617
      }
    }
  ],
  "model_input_policy": "Use the 120-state mechanism timeline as motion truth; the accepted rendered sequence is appearance evidence only.",
  "motion_classes": [
    "material_transport",
    "boundary_evolution",
    "flow_rerouting"
  ],
  "program_video": {
    "path": "modules/video_model/stage1/output/keyframe_render/delta_sequence/sequence-contact-sheet.jpg",
    "sha256": "b094c3d54074aa098715dfa171fd60a2218c6498c2265443a8c667cabdf76669",
    "size_bytes": 109071
  },
  "schema_version": "1.0",
  "state_timeline": {
    "path": "modules/video_model/stage1/output/causal_delta/mechanism/states.jsonl",
    "sha256": "d77376df2cf0d556cfb52f7cc4053b375496f52d5e267ae2bb90e3760d0a3e6c",
    "size_bytes": 12439478
  },
  "temporal_gates": [
    "shoreline_and_camera_are_fixed",
    "sediment_stage_order_is_preserved",
    "final_flow_has_exactly_two_paths_around_one_sandbar"
  ]
}
