{
  "case_id": "GEO-02",
  "keyframe_selection": [
    {
      "keyframe_id": "00_start",
      "order": 0,
      "state": {
        "path": "modules/video_model/stage2/output/phase-2/GEO-02/keyframes/00_start/state.json",
        "sha256": "56a1acaa841963019b04ab5db5a9e887306823bcd5896dd65ffc72d1bf0fa99c",
        "size_bytes": 291
      }
    },
    {
      "keyframe_id": "01_mechanism",
      "order": 1,
      "state": {
        "path": "modules/video_model/stage2/output/phase-2/GEO-02/keyframes/01_mechanism/state.json",
        "sha256": "2672ad8b7d836653d992d5d705fe2f75ea6844e35c7a56472dad5c0dd02b85af",
        "size_bytes": 302
      }
    },
    {
      "keyframe_id": "02_result",
      "order": 2,
      "state": {
        "path": "modules/video_model/stage2/output/phase-2/GEO-02/keyframes/02_result/state.json",
        "sha256": "7fbdc6e944178655c2e66e26e5725d79d25ea74812404889e3fc8b58e3f89fa6",
        "size_bytes": 299
      }
    },
    {
      "keyframe_id": "03_end",
      "order": 3,
      "state": {
        "path": "modules/video_model/stage2/output/phase-2/GEO-02/keyframes/03_end/state.json",
        "sha256": "bf477e5819a9fbbca055f31ff9fc3672ca4a39cc19c4147c4152077a0ea846a6",
        "size_bytes": 295
      }
    }
  ],
  "model_input_policy": "The full timeline is used to extract direction, topology, speed trend, and occlusion constraints. Raw program video is not a default pixel input to an image or video model.",
  "motion_classes": [
    "field_advection"
  ],
  "program_video": {
    "path": "modules/video_model/stage2/output/phase-2/GEO-02/program-animation.mp4",
    "sha256": "c4de0fa88e23ee00efb515633d7679b223343c0d7bfcaf61324d9c7f36a3ccaa",
    "size_bytes": 85101
  },
  "schema_version": "1.0",
  "state_timeline": {
    "path": "modules/video_model/stage2/output/phase-2/GEO-02/states.jsonl",
    "sha256": "0b07053703bd96b2d7dc495d8bcf5818004bd2ae5ebd8778a73e63e94e502f27",
    "size_bytes": 12767
  },
  "temporal_gates": [
    "terrain_is_fixed",
    "primary_rain_is_on_windward_side",
    "leeward_humidity_and_rainfall_decrease",
    "camera_and_background_remain_fixed",
    "no_uncontracted_object_birth_or_loss"
  ]
}
